<?xml version="1.0" encoding="UTF-8"?>
<!DOCTYPE rutas SYSTEM "rutas.dtd">
<rutas>
    <ruta id="ruta1">
        <nombre>Ruta Monumental del Casco Histórico de Girona</nombre>
        <tipo>Arquitectura y monumentos</tipo>
        <transporte>A pie</transporte>
        <fechaInicio>2024-03-15</fechaInicio>
        <horaInicio>09:30</horaInicio>
        <duracion>3 horas</duracion>
        <agencia>Girona Turisme</agencia>

        <descripcion>
            Recorrido circular por el casco histórico medieval de Girona, uno de los mejor
            conservados de Cataluña. La ruta combina el paseo arqueológico por las murallas
            carolingias con los monumentos más emblemáticos de la ciudad: la Catedral gótica,
            el barrio judío (Call), los Baños Árabes, el monasterio de Sant Pere de Galligants
            y las coloridas Casas del Onyar. El recorrido discurre principalmente por adoquines
            y escalinatas históricas, con desniveles moderados al subir a las murallas.
        </descripcion>

        <adecuadaPara>
            Personas en buena forma física; no recomendada para personas con movilidad reducida
            por las escalinatas de acceso a las murallas (230 peldaños). Apta para familias con
            niños mayores de 8 años. Tercera edad con buenas condiciones físicas.
        </adecuadaPara>

        <inicio>
            <lugar>Monasterio de Sant Pere de Galligants</lugar>
            <direccion>Carrer de Santa Llúcia, s/n</direccion>
            <coordenadas>
                <longitud>2.82571</longitud>
                <latitud>41.99104</latitud>
                <altitud>75</altitud>
            </coordenadas>
        </inicio>

        <referencias>
            <referencia url="https://www.girona.cat/turisme">
                Girona Turisme — Oficina oficial de turismo del Ayuntamiento de Girona
            </referencia>
            <referencia url="https://es.wikipedia.org/wiki/Casco_antiguo_de_Gerona">
                Wikipedia — Casco antiguo de Gerona: historia y monumentos
            </referencia>
            <referencia url="http://www.gironaviajesbaratos.com/ruta-paseo-murallas/">
                Girona Viajes — Ruta del Paseo de las Murallas de Girona
            </referencia>
        </referencias>

        <recomendacion>9</recomendacion>

        <hitos>
            <!-- HITO 1 -->
            <hito id="h1_01">
                <nombre>Monasterio de Sant Pere de Galligants</nombre>
                <descripcion>
                    Monasterio benedictino románico del siglo XII que actúa como sede del Museo de
                    Arqueología de Cataluña en Girona. Presenta una magnífica iglesia con cabecera
                    de cinco ábsides y un claustro de extraordinaria riqueza escultórica. Es el
                    punto de partida natural de la ruta por las murallas.
                </descripcion>
                <coordenadas>
                    <longitud>2.82571</longitud>
                    <latitud>41.99104</latitud>
                    <altitud>75</altitud>
                </coordenadas>
                <distancia unidad="m">0</distancia>
                <fotos>
                <foto url="fotos/girona/sant_pere_galligants_01.jpg"
                        descripcion="Fachada románica del monasterio de Sant Pere de Galligants"/>
                <foto url="fotos/girona/sant_pere_galligants_02.jpg"
                        descripcion="Claustro interior con capiteles románicos esculpidos"/>
                <foto url="fotos/girona/sant_pere_galligants_03.jpg"
                        descripcion="Exposición permanente del Museo de Arqueología de Cataluña"/>
                </fotos>
                <videos>
                <video url="videos/girona/sant_pere_galligants_tour.mp4"
                        descripcion="Visita virtual 360° al monasterio y su claustro"/>
                </videos>
            </hito>
            
            <puntoRuta seq="1">
                <coordenadas>
                    <longitud>2.82598</longitud>
                    <latitud>41.99050</latitud>
                    <altitud>76</altitud>
                </coordenadas>
                <distancia unidad="m">65</distancia>
            </puntoRuta>

            <puntoRuta seq="2">
                <coordenadas>
                    <longitud>2.82620</longitud>
                    <latitud>41.99010</latitud>
                    <altitud>88</altitud>
                </coordenadas>
                <distancia unidad="m">75</distancia>
            </puntoRuta>

            <!-- HITO 2 -->
            <hito id="h1_02">
                <nombre>Paseo Arqueológico de las Murallas</nombre>
                <descripcion>
                    Las murallas de Girona conforman uno de los paseos arqueológicos más
                    espectaculares de Cataluña. De origen romano, ampliadas en época carolingia
                    y medieval, permiten recorrer el perímetro del casco antiguo a gran altura,
                    ofreciendo vistas panorámicas de la ciudad, los Pirineos y el río Onyar.
                    El acceso desde el monasterio requiere subir 230 peldaños de escaleras metálicas.
                </descripcion>
                <coordenadas>
                    <longitud>2.82640</longitud>
                    <latitud>41.99020</latitud>
                    <altitud>102</altitud>
                </coordenadas>
                <distancia unidad="m">280</distancia>
                <fotos>
                <foto url="fotos/girona/murallas_panoramica_01.jpg"
                        descripcion="Vista panorámica de Girona desde el adarve de las murallas"/>
                <foto url="fotos/girona/murallas_torre_01.jpg"
                        descripcion="Torre Gironella, punto más alto del recinto amurallado"/>
                <foto url="fotos/girona/murallas_catedral_01.jpg"
                        descripcion="Vista de la Catedral de Girona desde las murallas"/>
                </fotos>
                <videos>
                <video url="videos/girona/murallas_paseo.mp4"
                        descripcion="Recorrido en vídeo por el paseo arqueológico de las murallas"/>
                <video url="videos/girona/murallas_amanecer.mp4"
                        descripcion="Amanecer sobre Girona filmado desde las murallas carolingias"/>
                </videos>
            </hito>
        
            <puntoRuta seq="3">
                <coordenadas>
                    <longitud>2.82690</longitud>
                    <latitud>41.98950</latitud>
                    <altitud>110</altitud>
                </coordenadas>
                <distancia unidad="m">95</distancia>
            </puntoRuta>

            <puntoRuta seq="4">
                <coordenadas>
                    <longitud>2.82660</longitud>
                    <latitud>41.98830</latitud>
                    <altitud>105</altitud>
                </coordenadas>
                <distancia unidad="m">140</distancia>
            </puntoRuta>

            <!-- HITO 3 -->
            <hito id="h1_03">
                <nombre>Catedral de Santa Maria de Girona</nombre>
                <descripcion>
                    La catedral gótica de Girona posee la nave gótica más ancha del mundo (23 metros),
                    construida entre los siglos XI y XVIII. Su espectacular escalinata barroca de 86
                    peldaños domina la plaza de los Apóstoles. Alberga el Tapís de la Creació,
                    el tapiz románico mejor conservado de Europa, y el Tresor de la Catedral.
                    Fue escenario de la serie Juego de Tronos.
                </descripcion>
                <coordenadas>
                    <longitud>2.82547</longitud>
                    <latitud>41.98715</latitud>
                    <altitud>88</altitud>
                </coordenadas>
                <distancia unidad="m">450</distancia>
                <fotos>
                <foto url="fotos/girona/catedral_escalinata_01.jpg"
                        descripcion="Escalinata barroca de 86 peldaños de la Catedral de Girona"/>
                <foto url="fotos/girona/catedral_nave_01.jpg"
                        descripcion="Nave gótica interior — la más ancha del mundo en estilo gótico"/>
                <foto url="fotos/girona/catedral_tapis_01.jpg"
                        descripcion="Detalle del Tapís de la Creació (Tapiz de la Creación), s. XI-XII"/>
                <foto url="fotos/girona/catedral_nocturna_01.jpg"
                        descripcion="Iluminación nocturna de la fachada de la catedral"/>
                </fotos>
                <videos>
                <video url="videos/girona/catedral_interior.mp4"
                        descripcion="Recorrido por el interior de la catedral y el tesoro"/>
                </videos>
            </hito>
        
            <puntoRuta seq="5">
                <coordenadas>
                    <longitud>2.82510</longitud>
                    <latitud>41.98690</latitud>
                    <altitud>82</altitud>
                </coordenadas>
                <distancia unidad="m">55</distancia>
            </puntoRuta>

            <!-- HITO 4 -->
            <hito id="h1_04">
                <nombre>El Call — Barrio Judío de Girona</nombre>
                <descripcion>
                    El Call de Girona es uno de los barrios judíos medievales mejor conservados de
                    Europa, habitado entre los siglos IX y XV. Sus callejuelas estrechas y empinadas
                    conservan sinagogas, hornos comunitarios y el Centro Bonastruc ça Porta (sede
                    del Museo de la Historia de los Judíos). La judería girones fue famosa en toda
                    Europa por su escuela cabalística.
                </descripcion>
                <coordenadas>
                    <longitud>2.82480</longitud>
                    <latitud>41.98650</latitud>